date_found;company;role;score;matching_skills;gaps;verdict;status;url
2026-06-12;Systerel;Ingénieur méthodes formelles H/F;5;Formal methods, Method B, Model-checking, verification, critical systems;None;Perfect match—formal methods-focused role at specialized firm with strong alignment to candidate's core expertise;new;https://www.systerel.fr/actualites/offre-emploi/ingenieur-hf-methodes-formelles/
2026-06-12;Systerel;Ingénieur Développement Logiciel Nucléaire H/F;4;C, critical systems, formal verification tools, safety-critical methodologies, nuclear domain;C instead of C++;less explicit FM emphasis, Excellent fit for critical systems work with formal verification components.;new;https://www.systerel.fr/actualites/offre-emploi/ingenieur-developpement-logiciel-nucleaire-h-f-aps_dev_nuc/
2026-06-12;Systerel;Ingénieur Évaluation H/F;3;Formal methods interest, risk analysis, safety cases, FMDS, critical systems, railway standards;Entry-level; no explicit formal verification, safety analysis not proof, Best fit of remaining: FM explicitly advantageous, analytical work in critical systems.;new;https://www.systerel.fr/actualites/offre-emploi/ingenieur-evaluation-h-f/
2026-06-12;Systerel;Ingénieur Évaluation Système H/F;3;System validation, EN 50126:2017, requirements traceability, railway domain, safety processes;Entry-level;focus on process/audit vs proof, no formal methods,V&V adjacent to formal methods, railway and critical systems alignment.;new;https://www.systerel.fr/actualites/offre-emploi/ingenieur-evaluation-systeme-h-f/
2026-06-12;Systerel;Ingénieur Intégration/Validation Logiciel/Système Sécuritaire H/F;3;C++, critical systems, railway/nuclear/aerospace domains, rigorous methodologies;Validation/testing focused;no FM mentioned, Strong domain and language alignment, validation testing peripheral to FM expertise.;new;https://www.systerel.fr/actualites/offre-emploi/ingenieur-integration-validation-logiciel-systeme-securitaire/
2026-06-12;Systerel;Ingénieur Validation Logiciel Temps Réel H/F;3;C++, critical systems validation, testing methodologies, systems thinking;No formal methods emphasis;Strong cultural fit with C++ and critical systems, validation is auxiliary to FM specialization.;new;https://www.systerel.fr/actualites/offre-emploi/ingenieur-validation-logiciel-temps-reel/
2026-06-12;Systerel;Ingénieur Développement Temps Réel H/F;2;Embedded systems, critical systems, V-cycle methodology, formal systems mindset;Requires Ada/C/C++;no formal verification or proof methods, Entry-mid level embedded role, FM expertise wouldn't be leveraged.;new;https://www.systerel.fr/actualites/offre-emploi/ingenieur-developpement-temps-reel-h-f/
2026-06-12;Systerel;Ingénieur développement Ada H/F;2;Critical systems expertise, railway/aerospace standards, constrained software, formal systems rigor;Heavy Ada focus;No FM component, Specialist Ada role, steep learning curve, FM skills don't translate directly.;new;https://www.systerel.fr/actualites/offre-emploi/ingenieur-h-f-developpement-ada-paris/
2026-06-12;Systerel;Ingénieur Qualité Logiciel & Systèmes informatiques H/F;2;Critical systems standards, EN 50128, DO 178C, quality rigor, audit methodology;No formal methods;Quality/process-focused, Lateral move to quality management, limited leverage of FM expertise.;new;https://www.systerel.fr/actualites/offre-emploi/ingenieur-qualite-logiciel-systemes-informatiques-h-f-ing_qualite/
2026-06-12;Systerel;Chef de Projet Systèmes Temps Réel H/F;1;Critical systems domain knowledge, V-cycle mastery, railway/energy sectors;Requires 8+ years professional + 2+ PM experience;No FM, Management position, no FM responsibilities, location mismatch (Aix).;new;https://www.systerel.fr/actualites/offre-emploi/chef-de-projet-systeme-temps-reel-h-f-aix-en-provence/
2026-06-12;IKOS Consulting;Ingénieur signalisation ferroviaire;1;Systems validation, critical infrastructure (railway), technical specification;Programmable automata/electrical engineering instead of software;No FM, location mismatch, Hardware/electrical automation domain poorly aligned with C++ and FM background.;new;https://www.ikosconsulting.com/nos-offres/ingenieur-signalisation-ferroviaire-lyon
2026-06-12;CEA;Chef de Projet informatique technique et Applications H/F;1;None directly relevant;Project management rather than technical;No FM, Management role, no FM relevance, location mismatch (Grenoble).;new;https://www.emploi.cea.fr/offre-de-emploi/emploi-chef-fe-de-projet-informatique-technique-et-applications-h-f_39874.aspx
2026-06-15;Systerel;Ingénieur Développement Java, Python, Eclipse H/F;2;Java, Python, Eclipse, formal methods tools;C++ preference, OCaml learning;Tools for formal methods rather than FM core expertise; Aix-en-Provence location not ideal.;new;https://www.systerel.fr/actualites/offre-emploi/ingenieur-developpement-java-python-eclipse-h-f-3/
2026-06-15;Systerel;Ingénieur Intégration/Validation Logiciel Nucléaire H/F;3;Software testing, verification, safety-critical systems, C programming;No explicit formal methods;Validation in critical nuclear systems; good domain fit despite location mismatch (Aix).;new;https://www.systerel.fr/actualites/offre-emploi/ingenieur-integration-validation-logiciel-nucleaire-h-f/
2026-06-15;Systerel;Chef de Projet Safety H/F;2;Project management, FMEA, risk analysis, safety standards;No technical execution role;Management position with domain expertise in critical systems safety; requires 5+ years experience.;new;https://www.systerel.fr/actualites/offre-emploi/ingenieur-surete-de-fonctionnement-experimente-sdf-h-f/
2026-06-15;Systerel;Ingénieur Sécurité en Données Ferroviaires Junior H/F;2;Railway safety domain, database validation, analytical thinking;Entry-level, no formal methods;Junior railway data validation role; Paris option available but entry-level position.;new;https://www.systerel.fr/actualites/offre-emploi/ingenieur-validation-donnees-ferroviaires-h-f/
2026-06-15;Systerel;Ingénieur Systèmes d'Information H/F;1;IT infrastructure management, Linux, Python, Java;Non-technical business role;IT management and infrastructure role; not aligned with formal methods specialization.;new;https://www.systerel.fr/actualites/offre-emploi/responsable-systemes-dinformation-h-f-dt_rsi/
2026-06-15;IKOS Consulting;Chargé(e) d'ADV (Administration des ventes);0;None;Not technical;Non-technical sales/administrative role; not aligned with formal methods or technical background.;new;https://www.ikosconsulting.com/nos-offres/chargee-dadv-administration-des-ventes
2026-06-15;IKOS Consulting;Responsable Comptabilité Internationale;0;None;Not technical, CDD contract;Non-technical accounting role with short-term contract; not aligned with technical specialization.;new;https://www.ikosconsulting.com/nos-offres/responsable-comptabilite-internationale-cdd-paris
2026-06-15;CEA;Ingénieur Sécurité d'Installation H/F;1;Safety-critical systems, installation security;Unclear technical focus;Unclear if technical role related to FM or more infrastructure-focused; location not ideal.;new;https://www.emploi.cea.fr/offre-de-emploi/emploi-ingenieur-securite-d-installation-h-f_40873.aspx
2026-06-15;CEA;Ingénieur Travaux et Maintenance H/F;1;Engineering basics;Maintenance/operations role;Maintenance and operations role; not aligned with formal methods specialization.;new;https://www.emploi.cea.fr/offre-de-emploi/emploi-ingenieur-travaux-et-maintenance-h-f_40650.aspx
2026-06-15;Inria;PhD - Formal Verification of Liveness in Distributed Systems;4;Formal verification, logic, automata, distributed systems;Research-focused (PhD), Rennes location;Excellent FM core role modeling protocol deadlock detection; location (Rennes) and PhD duration not ideal.;new;https://jobs.inria.fr/public/classic/en/offres/2026-10073
2026-06-15;Inria;Research Engineer Static Analysis of OCaml Programs;3;Static program analysis, abstract interpretation, functional programming, OCaml;Learning OCaml;Verification through static analysis of OCaml; candidate learning OCaml makes this opportunity for growth; location (Rennes) mismatch.;new;https://jobs.inria.fr/public/classic/en/offres/2026-09842
2026-06-15;Inria;Ingénieur scientifique - Macro system for Rocq;5;Rocq, formal proof assistants, type theory, OCaml, language design;Learning OCaml, Rennes location;Perfect match for FM specialization; designing expressive macro system for Rocq proof assistant; excellent opportunity despite location mismatch.;new;https://jobs.inria.fr/public/classic/en/offres/2026-10117
2026-06-15;Inria;Ingénieur Produit - Formal Proof Software;0;Product discovery, customer interviews, B2B;Not technical;Non-technical product/business development role for proof software; not aligned with technical FM expertise.;new;https://jobs.inria.fr/public/classic/en/offres/2026-10095
2026-06-15;Inria;Post-Doctorant - Formally Verified Alignments Proof Assistants;4;Type theory, Rocq, proof assistants, formal code with dependent types;Postdoc/Rennes location;High-level FM research with Rocq using Trocq framework; excellent FM fit with type theory focus; location and postdoc duration not ideal.;new;https://jobs.inria.fr/public/classic/en/offres/2026-09947
2026-06-15;Inria;Post-Doctoral - ProVerif Verification in Isabelle/HOL;4;Formal verification, Isabelle/HOL, first-order logic, cryptographic protocols;Postdoc/Villers-lès-Nancy location;Core FM role formalizing ProVerif tool; excellent fit with Isabelle theorem proving; location and postdoc duration not ideal.;new;https://jobs.inria.fr/public/classic/en/offres/2026-10141
2026-06-15;Inria;Temporary Engineer - Rocq Computer Algebra Libraries;4;OCaml, Rocq, proof assistants, foreign-function interfaces, C integration;Learning OCaml, Lyon location;High FM value connecting Rocq to numerical libraries; OCaml learning opportunity; location and contract duration mismatch.;new;https://jobs.inria.fr/public/classic/en/offres/2026-10136
2026-06-15;Inria;PhD - Post-Quantum Secure Messaging Verification;4;Formal verification, cryptography, proof assistants (Squirrel), formal proofs;PhD position/Villers-lès-Nancy location;Excellent FM role in cryptographic protocol verification; formal proof development with Squirrel; location and PhD duration not ideal.;new;https://jobs.inria.fr/public/classic/en/offres/2026-10107
2026-06-15;Inria;Engineer - Interactive Tools for Rocq Proof Development;4;OCaml, Rocq, proof assistants, VS Code integration, LSP/MCP protocols;Learning OCaml, Nantes location;Excellent FM tool development connecting Rocq with VS Code and LLM integration; OCaml learning opportunity; location and contract duration mismatch.;new;https://jobs.inria.fr/public/classic/en/offres/2026-09943
2026-06-15;Inria;Post-Doctoral - Semantics of Mathematical Proofs;4;Type theory, proof theory, mathematical logic, formal semantics, proof assistants;Postdoc/Villers-lès-Nancy location;High-level FM research in proof semantics; type theory and logic focus; location and postdoc duration not ideal.;new;https://jobs.inria.fr/public/classic/en/offres/2026-10148
2026-06-16;Systerel;Ingénieur Développement Logiciel Sécuritaire H/F;2;C++, critical systems, safety-critical software, V-cycle methodology;No formal methods, entry-level position;Critical systems role with C++ but lacks formal methods focus, entry-level position;new;https://www.systerel.fr/actualites/offre-emploi/ingenieur-systeme-sur/
2026-06-16;CEA;Ingénieur d'étude en microbiologie H/F;0;None;Wrong domain, biology not software engineering;Microbiology research role unrelated to candidate's FM specialization;new;https://www.emploi.cea.fr/offre-de-emploi/emploi-ingenieur-d-etude-en-microbiologie-h-f_40889.aspx
2026-06-16;CEA;Chargé de projet RH en alternance M1/M2 H/F;0;None;Non-technical HR role;HR recruitment coordination role for work-study students unaligned with technical specialization;new;https://www.emploi.cea.fr/offre-de-emploi/emploi-charge-de-projet-rh-en-alternance-m1-m2-h-f-h-f_40883.aspx
2026-06-16;CEA;Correspondant périmètre Déchets sans filières H/F;0;None;Non-technical waste management role, location not Paris;Nuclear waste management coordination role not aligned with software engineering expertise;new;https://www.emploi.cea.fr/offre-de-emploi/emploi-correspondant-perimetre-dechets-sans-filieres-h-f_40803.aspx
2026-06-16;CEA;Technicien environnement F/H;0;None;Technical but non-software domain, radioactivity/environmental focus;Environmental monitoring technician role with no alignment to formal methods or software expertise;new;https://www.emploi.cea.fr/offre-de-emploi/emploi-technicien-environnement-f-h-_40796.aspx
2026-06-16;Inria;10054 - Post-Doctoral Research Visit F/M Distributed Learning for Streaming Data;3;security, cryptography;non-Paris location;FM adjacent with relevant skills;new;https://jobs.inria.fr/public/classic/en/offres/2026-10054
2026-06-16;Inria;09923 - Post-Doctoral Research Visit F/M Distributed Machine Learning at the Network Edge;3;security, distributed system;;FM adjacent with relevant skills;new;https://jobs.inria.fr/public/classic/en/offres/2026-09923
2026-06-16;Inria;10034 - Post-Doctoral Research Visit F/M Post-doctoral Researcher - Expressivity of Implicit neural networks for data-driven stability and safety certificates;2;security;;Some technical relevance;new;https://jobs.inria.fr/public/classic/en/offres/2026-10034
2026-06-16;Inria;10057 - Post-Doctoral Research Visit F/M From the ocean to the stars: SciML to accelerate scientific research;2;security;;Some technical relevance;new;https://jobs.inria.fr/public/classic/en/offres/2026-10057
2026-06-16;Inria;10130 - PhD Position F/M Defending deployed AI models: manipulation as a countermeasure;2;security;non-Paris location;Some technical relevance;new;https://jobs.inria.fr/public/classic/en/offres/2026-10130
2026-06-16;Inria;10163 - Post-Doctoral Research Visit F/M Study of Fourier Analysis in Spheres and Applications to Cryptography;3;security, cryptography;;FM adjacent with relevant skills;new;https://jobs.inria.fr/public/classic/en/offres/2026-10163
2026-06-16;Inria;"10161 - PhD Position F/M Study of Optimal Solutions of Delsarte&#039;s Linear Program and Application to Regev&#039;s Reduction";2;security;;Some technical relevance;new;https://jobs.inria.fr/public/classic/en/offres/2026-10161
2026-06-16;Inria;09924 - Post-Doctoral Research Visit F/M From AI audits to AI security: an information gain hierarchy;2;security;non-Paris location;Some technical relevance;new;https://jobs.inria.fr/public/classic/en/offres/2026-09924
2026-06-16;Inria;10059 - PhD Position F/M PhD - Robust few-shot learning for foundational model in CT imaging;2;security;;Some technical relevance;new;https://jobs.inria.fr/public/classic/en/offres/2026-10059
2026-06-16;Inria;10053 - Post-Doctoral Research Visit F/M Embedded Systems, Neural Networks and Privacy-preserving Embedded Edge AI Techniques;2;security;;Some technical relevance;new;https://jobs.inria.fr/public/classic/en/offres/2026-10053
2026-06-16;Inria;10067 - Assistant-e de service;2;security;non-Paris location;Some technical relevance;new;https://jobs.inria.fr/public/classic/en/offres/2026-10067
2026-06-16;Inria;10069 - Doctorant F/H Perception et interaction via des Avatars en réalité virtuelle;2;security;non-Paris location;Some technical relevance;new;https://jobs.inria.fr/public/classic/en/offres/2026-10069
2026-06-16;Inria;10094 - PhD Position F/M PhD - Building a foundational model for abdominal CT imaging;2;security;;Some technical relevance;new;https://jobs.inria.fr/public/classic/en/offres/2026-10094
2026-06-16;Inria;08759 - Post-Doctoral Research Visit F/M Model placement in inference delivery networks;3;security, programming language;;FM adjacent with relevant skills;new;https://jobs.inria.fr/public/classic/en/offres/2025-08759
2026-06-16;Inria;09997 - PhD Position F/M Generalized Wasserstein barycenters and applications;2;security;;Some technical relevance;new;https://jobs.inria.fr/public/classic/en/offres/2026-09997
2026-06-16;Inria;10150 - PhD Position F/M Interoperability for Synthetic Mathematics in a Proof Assistant;5;security, verification, proof assistant;;Core FM role;new;https://jobs.inria.fr/public/classic/en/offres/2026-10150
2026-06-16;Inria;09979 - Doctorant F/H Analyse biomécanique in situ et reconstruction 3D holistique (athlète-matériel-environnement) pour l’optimisation de la performance en voile de compétition.;2;security;non-Paris location;Some technical relevance;new;https://jobs.inria.fr/public/classic/en/offres/2026-09979
2026-06-16;Inria;09926 - PhD Position F/M Multi-Fidelity Scientific Machine Learning with Heterogeneous Inputs;2;security;;Some technical relevance;new;https://jobs.inria.fr/public/classic/en/offres/2026-09926
2026-06-16;Inria;10174 - Chargé d’affaires mobilières et patrimoniales H/F;2;security;non-Paris location;Some technical relevance;new;https://jobs.inria.fr/public/classic/en/offres/2026-10174
2026-06-16;Inria;09909 - Post-Doctoral Research Visit F/M Robust optimisation methods for sparse-sensor placement for fault detection in vibrating mechanical structures;2;security;;Some technical relevance;new;https://jobs.inria.fr/public/classic/en/offres/2026-09909
2026-06-16;Inria;09952 - Post-Doctoral Research Visit F/M Physics-Informed Learning Models for Forecasting E-Flexibility in Electric Vehicles (EVs);3;security, verification;non-Paris location;FM adjacent with relevant skills;new;https://jobs.inria.fr/public/classic/en/offres/2026-09952
2026-06-16;Inria;09988 - Post-Doctoral Research Visit F/M Large Physics Models;2;security;;Some technical relevance;new;https://jobs.inria.fr/public/classic/en/offres/2026-09988
2026-06-16;Inria;10040 - PhD Position F/M PhD Position - Structural Methods for Mixed Model/Data Digital Twin Engineering;2;security;non-Paris location;Some technical relevance;new;https://jobs.inria.fr/public/classic/en/offres/2026-10040
2026-06-16;Inria;10048 - DAE-based Contracts;3;security, verification;non-Paris location;FM adjacent with relevant skills;new;https://jobs.inria.fr/public/classic/en/offres/2026-10048
2026-06-16;Inria;10047 - PhD Position F/M Filippov Solutions for Discontinuous Differential-Algebraic Equations (DAEs): Control and Simulation;2;security;non-Paris location;Some technical relevance;new;https://jobs.inria.fr/public/classic/en/offres/2026-10047
2026-06-16;Inria;09823 - Agentic AI for resource allocation in future networks;3;security, distributed system;non-Paris location;FM adjacent with relevant skills;new;https://jobs.inria.fr/public/classic/en/offres/2026-09823
2026-06-16;Inria;10077 - Project Manager for Digital Twins of Territories;2;security;;Some technical relevance;new;https://jobs.inria.fr/public/classic/en/offres/2026-10077
2026-06-16;Inria;10105 - Post-Doctoral Research Visit F/M Benchmarks for Evaluating LLMs for Lean Elegance;3;security, static analysis;;FM adjacent with relevant skills;new;https://jobs.inria.fr/public/classic/en/offres/2026-10105
2026-06-16;Inria;10114 - Post-Doctoral Research Visit F/M Crowd dynamics data acquisition and processing for large-scale dataset construction;2;security;non-Paris location;Some technical relevance;new;https://jobs.inria.fr/public/classic/en/offres/2026-10114
2026-06-16;Inria;10115 - Post-Doctoral Research Visit F/M Learning crowd dynamics from real-world data;2;security;non-Paris location;Some technical relevance;new;https://jobs.inria.fr/public/classic/en/offres/2026-10115
2026-06-16;Inria;10126 - Orchestration of AI Services on Telco Cloud Platforms: Dynamic Models, Energy Efficiency and Edge-Cloud Deployment;3;security, distributed system;;FM adjacent with relevant skills;new;https://jobs.inria.fr/public/classic/en/offres/2026-10126
2026-06-16;Inria;09875 - Responsable du pôle pilotage des processus et des campagnes;2;security;non-Paris location;Some technical relevance;new;https://jobs.inria.fr/public/classic/en/offres/2026-09875
2026-06-16;Inria;09808 - PhD Position F/M Dynamic Approximate Computing for Energy-Efficient AI Hardware Accelerators;2;security;non-Paris location;Some technical relevance;new;https://jobs.inria.fr/public/classic/en/offres/2026-09808
2026-06-16;Inria;09830 - PhD Position F/M Visuo-tactile control for manipulating deformable objects with robotic arms combining tactile perception and photometric visual servoing;2;security;non-Paris location;Some technical relevance;new;https://jobs.inria.fr/public/classic/en/offres/2026-09830
2026-06-16;Inria;10007 - Post-Doctoral Research Visit F/M Quantum causality in symmetry-constrained systems;3;security, cryptography;;FM adjacent with relevant skills;new;https://jobs.inria.fr/public/classic/en/offres/2026-10007
2026-06-16;Inria;10021 - Post-Doctoral Research Visit F/M Bridging the gap between combinatorial proof theory and subatomic proof theory;5;formal verification, security, verification;;Core FM role;new;https://jobs.inria.fr/public/classic/en/offres/2026-10021
2026-06-16;Inria;10071 - PhD Position F/M PhD Position F/M: How does Reasoning with LLM Help Repair Vulnerabilities in Repo-level Software Projects?;3;security, programming language, static analysis;non-Paris location;FM adjacent with relevant skills;new;https://jobs.inria.fr/public/classic/en/offres/2026-10071
2026-06-16;Inria;10006 - Research engineer in biostatistics;2;security;non-Paris location;Some technical relevance;new;https://jobs.inria.fr/public/classic/en/offres/2026-10006
2026-06-16;Inria;10008 - Research Engineer / Postdoctoral Researcher @Grenoble: Conditional Generative PDE Surrogates for Ocean Model;3;security, verification;non-Paris location;FM adjacent with relevant skills;new;https://jobs.inria.fr/public/classic/en/offres/2026-10008
2026-06-16;Inria;10111 - Software engineer for MAPIE – P16 (M/F);2;security;;Some technical relevance;new;https://jobs.inria.fr/public/classic/en/offres/2026-10111
2026-06-16;Inria;10176 - Research engineer, greenhouse gas emissions retrieval by satellite and uncertainty quantification (24 months);2;security;non-Paris location;Some technical relevance;new;https://jobs.inria.fr/public/classic/en/offres/2026-10176
2026-06-16;Inria;10170 - Post-Doctoral Research Visit F/M Post-Doctoral Research F/M in energetic cost of fault-tolerant quantum computing;2;security;non-Paris location;Some technical relevance;new;https://jobs.inria.fr/public/classic/en/offres/2026-10170
2026-06-16;Inria;10162 - Stage Ingénieur IA en computer vision – Inria Startup Studio;2;security;non-Paris location;Some technical relevance;new;https://jobs.inria.fr/public/classic/en/offres/2026-10162
2026-06-16;Inria;10159 - PhD Position F/M Multi-Perspective Data Interlinking: Combining Standpoint Logic and Link Keys for the Digital Twin of France;3;security, consensus, verification;non-Paris location;FM adjacent with relevant skills;new;https://jobs.inria.fr/public/classic/en/offres/2026-10159
2026-06-16;Inria;10149 - PhD Position F/M PhD Thesis: Speech Enhancement with Distributed Microphone Arrays by Combining Acoustics and Machine Learning;2;security;non-Paris location;Some technical relevance;new;https://jobs.inria.fr/public/classic/en/offres/2026-10149
2026-06-16;Inria;10147 - Responsable de plateforme de données sur l’antibiorésistance : maintenance, exploitation et analyse de données;2;security;non-Paris location;Some technical relevance;new;https://jobs.inria.fr/public/classic/en/offres/2026-10147
2026-06-16;Inria;10152 - Post-Doctoral Research Visit F/M Adapting vision-language and multi-modal large language models;3;security, verification;non-Paris location;FM adjacent with relevant skills;new;https://jobs.inria.fr/public/classic/en/offres/2026-10152
2026-06-16;Inria;"10160 - Post-Doctorant F/H Modélisation des effets de la stimulation électrique appliquée à la substance blanche du cerveau: modèles biophysiques d&#039;axones, équations de câbles en tenant compte des contraintes anatomiques";2;security;non-Paris location;Some technical relevance;new;https://jobs.inria.fr/public/classic/en/offres/2026-10160
2026-06-16;Inria;10164 - Post-Doctoral Research Visit F/M Multi-modal Co-Learning for sensor-specific FMs;2;security;non-Paris location;Some technical relevance;new;https://jobs.inria.fr/public/classic/en/offres/2026-10164
2026-06-16;Inria;10153 - Chargé/e de mission relations institutionnelles;2;security;;Some technical relevance;new;https://jobs.inria.fr/public/classic/en/offres/2026-10153
2026-06-16;Inria;10066 - LPWAN wireless Gateway Open-Source Embedded Rust Prototyping;3;security, consensus;;FM adjacent with relevant skills;new;https://jobs.inria.fr/public/classic/en/offres/2026-10066
2026-06-16;Inria;10173 - Post-Doctoral Research Visit F/M Investigating the Capacities of Foundation Models for 3D Scene Creation and Editing;2;security;non-Paris location;Some technical relevance;new;https://jobs.inria.fr/public/classic/en/offres/2026-10173
2026-06-16;Inria;10140 - Ingénieur H/F Anonymisation acoustique et sémantique de la parole.;2;security;non-Paris location;Some technical relevance;new;https://jobs.inria.fr/public/classic/en/offres/2026-10140
2026-06-16;Inria;"10139 - Ingénieur Management de projet Domaine Agri-Agro &amp; Numérique";2;security;non-Paris location;Some technical relevance;new;https://jobs.inria.fr/public/classic/en/offres/2026-10139
2026-06-16;Inria;10143 - PhD Position F/M Optimal Control and Experimental Design (Project OCARINA);2;security;non-Paris location;Some technical relevance;new;https://jobs.inria.fr/public/classic/en/offres/2026-10143
2026-06-16;Inria;10138 - Engineer Position - Development of a Myoelectric Hand Prosthesis - M/F;3;security, verification;non-Paris location;FM adjacent with relevant skills;new;https://jobs.inria.fr/public/classic/en/offres/2026-10138
